RecipeId,Name,CookTime,Preime,TotalTime,Images,RecipeCategory,Keywords,RecipeIngredientQuantities,RecipeIngredientParts,Calories,FatContent,SaturatedFatContent,CholesterolContent,SodiumContent,CarbohydrateContent,FiberContent,SugarContent,ProteinContent,RecipeServings,RecipeYield,RecipeInstructions
58,Low-Fat Burgundy Beef & Vegetable Stew,2H14M,30M,2H44M,"c(""https://img.sndimg.com/food/image/upload/w_555,h_416,c_fit,fl_progressive,q_95/v1/img/recipes/58/picnE8qoe.jpg"", ""https://img.sndimg.com/food/image/upload/w_555,h_416,c_fit,fl_progressive,q_95/v1/img/recipes/58/picwiayaY.jpg"", ""https://img.sndimg.com/food/image/upload/w_555,h_416,c_fit,fl_progressive,q_95/v1/img/recipes/58/picAaGXgc.jpg"", ""https://img.sndimg.com/food/image/upload/w_555,h_416,c_fit,fl_progressive,q_95/v1/img/recipes/58/picD2ey4Z.jpg"", ""https://img.sndimg.com/food/image/upload/w_555,h_416,c_fit,fl_progressive,q_95/v1/img/recipes/58/picKtSTwb.jpg"", 
""https://img.sndimg.com/food/image/upload/w_555,h_416,c_fit,fl_progressive,q_95/v1/img/recipes/58/picY2Aqui.jpg"")",Stew,"c(""Vegetable"", ""Meat"", ""Low Cholesterol"", ""Healthy"", ""Free Of..."", ""Weeknight"", ""< 4 Hours"")","c(""1 1/2"", ""1"", ""1"", ""1/2"", ""1/2"", ""1"", ""1/2"", ""3"", ""5 1/2"", ""1"", ""2"", ""1"")","c(""beef eye round"", ""dried thyme leaves"", ""salt"", ""pepper"", ""ready-to-serve beef broth"", ""Burgundy wine"", ""garlic"", ""cornstarch"", ""frozen sugar snap peas"")",280.1,6,1.5,66.9,591.5,22.4,6.1,9.2,29.8,6,NA,"c(""Trim fat from beef, cut into 1-inch pieces."", ""In Dutch oven, heat oil over medium high hunt until hot. Add beef (half at a time) and brown evenly, stirring occasionally."", ""Pour off drippings."", ""Season with thyme, salt and pepper."", ""Stir in broth, wine and garlic. Bring to boil; reduce heat to low."", ""Cover tightly and simmer 1 1/2 hours."", ""Add carrots and onions."", ""Cover and continue cooking 35 to 40 minutes or until beef and vegetables are tender."", ""Bring beef stew to a boil over medium-high heat. Add cornstarch mixture; cook and stir 1 minute. Stir in sugar snap peas."", 
""Reduce heat to medium and cook 3 to 4 minutes or until peas are heated through."")"
59,Lou's Fabulous Bruschetta,10M,30M,40M,"""https://img.sndimg.com/food/image/upload/w_555,h_416,c_fit,fl_progressive,q_95/v1/img/recipes/59/pickKDLXe.jpg""",Vegetable,"c(""European"", ""Low Cholesterol"", ""Healthy"", ""Spring"", ""Summer"", ""< 60 Mins"", ""Oven"")","c(""1"", NA, NA, ""3/4"", NA, NA, ""4 -5"", ""1 -2"", ""4 -5"")","c(""French baguette"", ""butter"", ""garlic powder"", ""ricotta cheese"", ""parmesan cheese"", ""salt"", ""tomatoes"", ""olive oil"", ""fresh basil leaves"")",221.5,6.5,2.5,11.8,367.8,32.5,2.5,1.8,8.1,8,NA,"c(""Cut baguette into slices."", ""Butter and then sprinkle garlic powder each piece, and bake till lightly golden brown."", ""Mix garlic powder, Parmesan cheese, and salt in the ricotta cheese, till a lovely blended taste."", ""Dice tomatoes in small cubes,   add Olive Oil, and  small strips of fresh basil leaves, cut into thin strips."", ""Spread the ricotta mixture, generously on the cooled garlic bread slices."", ""Top with tomato mixture and bake at 350F for 10 minutes."", ""Enjoy!"")"
60,Blueberry Dessert,NA,35M,35M,character(0),Dessert,"c(""Berries"", ""Fruit"", ""< 60 Mins"", ""Oven"")","c(""2"", ""1/2"", ""1/2"", ""2"", ""16"", ""1"", ""1"", ""1/4"")","c(""Bisquick baking mix"", ""sugar"", ""butter"", ""margarine"", ""eggs"", ""frozen blueberries"", ""Bisquick baking mix"", ""sugar"", ""firm butter"", ""margarine"")",381.1,17.3,8.8,62.1,437.6,54.5,1.6,36.9,3.9,12,NA,"c(""Heat oven to 400 degrees."", ""Mix 2 cups baking mix, 1/2 cup sugar, 1/2 cup butter  and egg yolks until crumbly."", ""Press into ungreased rectangular pan, 13x9x2\""."", ""Bake 10 min."", ""Beat egg whites until stiff; fold in blueberries."", ""Spread over baked  layer."", ""Mix remaining ingredients until crumbly; sprinkle over blueberry mixture. Bake until golden brown, about 20 min."")"
62,"Black Bean, Corn, and Tomato Salad",15M,10M,25M,character(0),Black Beans,"c(""Corn"", ""Beans"", ""Vegetable"", ""Low Cholesterol"", ""Healthy"", ""Free Of..."", ""Spring"", ""Summer"", ""< 30 Mins"", ""Easy"")","c(""3"", ""2"", ""1"", ""1"", ""1"", ""1"", ""2"", ""1"", ""4"")","c(""fresh lemon juice"", ""olive oil"", ""black beans"", ""fresh corn kernels"", ""plum tomato"", ""scallion"", ""fresh parsley leaves"", ""cayenne"", ""boston lettuce leaves"")",407.8,15.4,2.3,0,20,55.8,16.6,4.3,17.1,2,NA,"c(""In a bowl whisk together lemon juice, oil, and salt to taste."", ""Stir in remaining ingredients, exce lettuce leaves, with salt and black pepper to taste."", ""Let salad stand, stirring once or twice, 15 minutes for flavors to develop."", ""Line 2 plates with lettuce and divide salad between them."")"
64,Almond Pound Cake,1H,15M,1H15M,character(0),Dessert,"c(""Fruit"", ""Nuts"", ""Weeknight"", ""Oven"", ""< 4 Hours"")","c(""2/3"", ""3 1/2"", ""1 1/4"", ""4"", ""2 1/4"", ""5"", ""1"", ""1/2"")","c(""butter"", ""almond paste"", ""sugar"", ""eggs"", ""flour"", ""cornstarch"", ""baking powder"", ""milk"")",408.5,17.9,9,118.9,159.4,56,1.3,29,6.9,10,1 cake,"c(""Preheat oven to 350 degrees Fahrenheit."", ""Cream butter and almond paste until fluffy."", ""Add sugar, gradually add eggs, one at a time.  Mix together flour, cornstarch and baking powder, then add flour mixture and milk alternately."", ""Bake in greased 9x5 loaf pan for 1 hour."", ""Double recipe for a bundt pan and bake 75 minute."", ""Cool 10 min in pan, then turn out and cool completely."", ""Serve with powdered sugar, orange glaze or chocolate glaze."")"
67,Bourbon Pecan Pound Cake,1H,1H,2H,character(0),Dessert,"c(""Fruit"", ""Nuts"", ""Weeknight"", ""Oven"", ""< 4 Hours"")","c(""1/2"", ""2 1/2"", ""6"", ""3"", ""2"", ""1"", ""1"", ""1"", ""1/2"", ""1 1/2"", ""2"", ""1"", ""2"")","c(""butter"", ""sugar"", ""eggs"", ""cake flour"", ""baking powder"", ""salt"", ""nutmeg"", ""sour cream"", ""Bourbon"", ""pecans"", ""powdered sugar"", ""Bourbon"", ""water"")",697.7,31.7,13.6,143.6,441.9,91.2,1.9,62.6,7.8,12,NA,"c(""Combine butter and sugar in bowl of electric mixer and blend until light and fluffy."", ""Add eggs one at a time, beating constantly."", ""Sift together flour, baking powder, salt, and nutmeg."", ""Blend sour cream and bourbon."", ""Alternately add flour and sour cream mixture to batter."", ""Add pecans."", ""Grease bottom and sides of tube or bunt pan."", ""Pour in batter and bake at 325 degrees for about one hour and 30 minutes."", ""Test cake frequently after first hour and 15 minutes for doneness."", ""Let cake cool in pan for 15 minutes before turning out on wire rack."", 
""To prepare glaze, combine sugar and bourbon."", ""Stir while gradually adding water."", ""Add only enough water to make a pourable glaze without allowing mixture to become too thin."", ""Pour glaze over top of warm cake and let dribble down sides."")"
68,Chicago Style Pizza,2H38M,35M,3H13M,character(0),Weeknight,"c(""Oven"", ""< 4 Hours"")","c(""1"", ""1 1/4"", ""1"", ""1 1/2"", ""1/4"", ""3"", ""2"", ""0.5"", ""1"", NA, NA, ""1/4"", ""1/4"", ""1/4"", ""1/4"", ""1/4"")","c(""dry yeast"", ""water"", ""sugar"", ""salt"", ""flour"", ""cornmeal"", ""mozzarella cheese"", ""oregano"", ""pepper"", ""green pepper"", ""mushroom"", ""parmesan cheese"")",471.4,24.5,10.1,55,990,41.1,1.9,2.5,20.9,8,8 slices,"c(""For crust, dissolve yeast in water."", ""Add sugar,  salt and 2 tablespoons oil."", ""Stir in flour to make a soft  dough."", ""Turn out onto well floured board."", ""Knead about 3  minutes."", ""Put in greased bowl; cover and let rise in warm place  about 1 1/2  hours."", ""Brush a 14-inch deep-dish pizza pan with  2 tablespoons oil; sprinkle  with corn meal."", ""Punch dough down;  press in bottom of pan."", ""Let rise 30 minutes."", ""Punch down  again, lightly coat with olive oil."", ""Cook at 450 degrees for  about  10 minutes until set. (Punch down dough after 5 minutes or so.) Arrange cheese  over dough."", 
""Place pepperoni,  olives, peppers and mushrooms over cheese. Spread  pizza sauce. Sprinkle with oregano, crushed pepper and  Parmesan cheese. Place  pizza in oven and cook at 450 degrees  until cheese is melted and crust is  golden (about 20 to 25 minutes). Makes  8 slices."")"
71,Chicken and Dumplings,43M,1H25M,2H8M,character(0),Whole Chicken,"c(""Chicken"", ""Poultry"", ""Meat"", ""Winter"", ""Weeknight"", ""Broil/Grill"", ""Oven"", ""Stove Top"", ""< 4 Hours"")","c(""4"", ""1"", ""2"", ""1"", ""2"", ""1/4"", ""1"", ""1"", ""1"", NA, NA, ""2"", ""1/4"", ""3"", ""3/4"", ""1"")","c(""chicken"", ""carrot"", ""celery"", ""onion"", ""chicken bouillon cubes"", ""butter"", ""flour"", ""sherry wine"", ""lemon juice"", ""salt"", ""baking powder"", ""salt"", ""shortening"", ""milk"", ""peas"")",657.9,42.7,14.4,188.7,637.7,19.1,2.1,2.6,46.1,8,NA,"c(""Place chickens in large saucepan, cover with water and bring to a boil."", ""Simmer until chickens are tender."", ""Remove chickens from pan and set aside. Remove backbones."", ""Add chopped carrot, celery and onion and simmer 30 minutes."", ""Add chicken stock base and remove from heat. Strain and reserve stock."", ""Melt butter and stir in 1 cup flour until smooth."", ""Add to straine reserved chicken stock."", ""Simmer 5 minutes."", ""Add sherry and lemon juice, salt to taste and, if desired, food color."", 
""For dumplings, combine 1 1/2 cups flour, baking powder and 1/4 tsp salt in mixing bowl."", ""Cut in shortening until mixture resembles cornmeal."", ""Stir in milk until just blended."", ""Place about 1/2 inch water in saucepan with wire rack that comes 2 to 3 inches above water line. Cover rack with lightly oiled waxed paper, oiled side up."", ""With water gently simmering, drop dumplings by tablespoon onto waxed paper, leaving room in between for expansion."", ""Steam 8 minutes, uncovered, then cover and steam 7 minutes longer."", 
""Meanwhile, remove skin from cooked chicken and bone, if desired."", ""Cut in large pieces."", ""Place chicken pieces in casserole. Arrange dumplings on chicken."", ""Cover with sauce and sprinkle with peas for color."")"
72,Brownie Pudding,35M,40M,1H15M,character(0),Dessert,"c(""Low Protein"", ""Healthy"", ""Weeknight"", ""Oven"", ""< 4 Hours"")","c(""1/2"", ""1/2"", ""1/2"", ""2"", ""1/4"", ""1/2"", ""1"", ""2"", ""1/2"", ""1/2"", ""1 3/4"")","c(""all-purpose flour"", ""granulated sugar"", ""baking powder"", ""salt"", ""milk"", ""vanilla"", ""butter"", ""brown sugar"", ""boiling water"")",182.8,5.9,3.6,7.8,160.2,34,2.1,25.3,2.3,10,NA,"c(""Preheat oven to 350 degrees."", ""Combine flour, granulated sugar, 1/4  cup cocoa,  baking powder and salt in a bowl."", ""Stir in milk, butter and vanilla  until  smooth."", ""Stir in chocolate chips."", ""Spread in ungreased shallow 1  1/2 quart  casserole.  Sprinkle brown sugar and 1/4 cup cocoa on top."", ""Place in oven, pour  boiling water over top."", ""Bake 35 minutes, cool 10 minutes before  serving."", ""Serve with ice cream if desired."")"
74,Brownie Cheesecake Torte,55M,35M,1H30M,"""https://img.sndimg.com/food/image/upload/w_555,h_416,c_fit,fl_progressive,q_95/v1/img/recipes/74/kZ2yXx22RimC8sHBAlFa_image.jpg""",Cheesecake,"c(""Dessert"", ""Weeknight"", ""Oven"", ""< 4 Hours"")","c(""15 1/4"", ""2"", ""1/2"", ""4"", NA, ""1/2"", ""2"", ""4"", ""1"", ""8"", ""8"", ""2"", ""3"", ""2"", NA, NA)","c(""instant coffee granules"", ""cinnamon"", ""sugar"", ""sugar"", ""all-purpose flour"", ""vanilla extract"", ""fat free cream cheese"", ""skim milk"", ""fresh raspberry"")",122.1,4.9,3,15.9,194.7,14.4,0.5,10.9,5.7,12,12,"c(""Preheat oven to 425 degrees F."", ""Combine first 4 ingredients in a bowl."", ""Firmly press mixture into bottom and 1 inch up sides of a 9-inch springform pan coated with cooking spray."", ""Set aside. Combine 1/2 cup sugar, flour, vanilla, and cheeses;  beat at medium speed of a mixer until well-blended."", ""Add egg whites and 2 tablespoons milk; beat well."", ""Combine 1/2 cup batter, 1 tablespoon milk, 2 tablespoons sugar, and cocoa in a small bowl; stir well."", ""Spoon remaining batter alternately with cocoa mixture into prepared crust. Swirl together using the tip of a knife.  Bake at 425 degrees for 10 minutes."", 
""Reduce oven temperature to 250 degrees; bake 45 minutes or until almost set. Cool completely on a wire rack."", ""Garnish with chocolate syrup and fresh raspberries, if desired."")"
75,California Chilled Salsa,NA,25M,25M,character(0),Sauces,"c(""Low Protein"", ""Low Cholesterol"", ""Healthy"", ""Free Of..."", ""< 30 Mins"")","c(""2"", ""1"", ""1"", ""1"", ""1 1/2"", ""1"", ""1"", ""1"")","c(""tomatoes"", ""celery"", ""onion"", ""green pepper"", ""salt"", ""cider vinegar"", ""sugar"", ""green chili pepper"")",21,0.1,0,0,354.9,4.9,0.9,3.3,0.6,10,NA,"c(""* Also delicious made with red sweet peppers or a combination of red and  green for nice color."", ""Combine all ingredients; if finer texture is desired may be put  through food grinder using fine blade."", ""Cover tightly and chill overnight."", ""Serving Ideas : Serve cold as a relish with meat."", ""Kim C."")"
76,Alfredo Sauce,10M,5M,15M,"c(""https://img.sndimg.com/food/image/upload/w_555,h_416,c_fit,fl_progressive,q_95/v1/img/recipes/76/lfS6kBlpRJMGzvXr3Gkz_AS%204%20-%20final_2.jpg"", ""https://img.sndimg.com/food/image/upload/w_555,h_416,c_fit,fl_progressive,q_95/v1/img/recipes/76/RU5fnqOQ6kQhNPHuyepw_AS%204%20-%20final_4.jpg"", ""https://img.sndimg.com/food/image/upload/w_555,h_416,c_fit,fl_progressive,q_95/v1/img/recipes/76/7Zay46y4T5iIMpwytGAh_9A7A15FF-075C-4696-911B-80C05EC777C8.jpeg"", ""https://img.sndimg.com/food/image/upload/w_555,h_416,c_fit,fl_progressive,q_95/v1/img/recipes/76/rD6D3t6SrmNouznAOrTT_IMG_1241.JPG"", 
""https://img.sndimg.com/food/image/upload/w_555,h_416,c_fit,fl_progressive,q_95/v1/img/recipes/76/pic9nC3rH.jpg"", ""https://img.sndimg.com/food/image/upload/w_555,h_416,c_fit,fl_progressive,q_95/v1/img/recipes/76/picOZfuNC.jpg"", ""https://img.sndimg.com/food/image/upload/w_555,h_416,c_fit,fl_progressive,q_95/v1/img/recipes/76/picvhwJQj.jpg"", ""https://img.sndimg.com/food/image/upload/w_555,h_416,c_fit,fl_progressive,q_95/v1/img/recipes/76/piczatR8o.jpg"", ""https://img.sndimg.com/food/image/upload/w_555,h_416,c_fit,fl_progressive,q_95/v1/img/recipes/76/picCBDhXY.jpg"", 
""https://img.sndimg.com/food/image/upload/w_555,h_416,c_fit,fl_progressive,q_95/v1/img/recipes/76/pict87aHR.jpg"")",Sauces,"c(""European"", ""Very Low Carbs"", ""High In..."", ""< 15 Mins"", ""Easy"")","c(""1/4"", ""1"", ""3/4"", NA, ""1/4"")","c(""sweet butter"", ""heavy cream"", ""parmesan cheese"", ""salt"", ""pepper"")",489.9,50.4,31.5,159,312.4,2.5,0,0.2,8.7,4,NA,"c(""Place butter in microwave safe pot and heat on high for 30 seconds or until melted."", ""Add cream and warm on high for approximately 1 minute."", ""Add Parmesan cheese and warm until cheese melts."", ""Add salt and pepper to taste. (If serving with shrimp, you might not need much salt.)."", ""Pour over 4 servings of warm noodles (I use angel hair) and toss to coat. Serve immediately."", ""Notes: I serve it with cubed, grilled or broiled chicken breast mixed in with the noodles or shrimp. Add a green salad and you have a complete meal. I have used margarine and canned Parmesan cheese and it worked fine.""
)"
79,Brisket with Sauerkraut and Applesauce,3H,25M,3H25M,character(0),Weeknight,"c(""Stove Top"", ""< 4 Hours"", ""Easy"")","c(""1"", ""8"", ""1"", ""2"", ""1"")","c(""stewed tomatoes"", ""sauerkraut"", ""applesauce"", ""dark brown sugar"", ""beef brisket"")",232.9,13.6,5.4,36.5,475.7,19.3,2.3,8.5,9.6,6,NA,"c(""In a large cook pot place undrained tomatoes, sauerkraut with applesauce and  brown sugar."", ""Bring to a boil."", ""Lower heat and add brisket so that mixture can  cover some of brisket.Cover and simmer until meat is fork tender ( about 3 hours ); spooning sauce over brisket intermittently."", ""When meat is done, place brisket  on serving platter."", ""Remove excess fat from pot. Season sauce to taste ( more  sugar, spices etc. ). Thicken if desired with a bit of cornstarch mixed with  some cold water and add to sauce and cook and stir till thickened."", 
""For best  serving, prepare brisket ahead of time, let cool completely, slice meat, cover  with sauce and refrigerate till needed ( may be frozen ). Gently reheat and  serve slices of meat and sauce."")"
80,Bread Pudding,45M,20M,1H5M,character(0),Dessert,"c(""Weeknight"", ""Oven"", ""< 4 Hours"")","c(""2"", ""1"", ""2"", ""2"", ""9"", ""1/2"", ""1"", ""2"", ""1/4"")","c(""milk"", ""eggs"", ""sugar"", ""salt"", ""real vanilla"", ""unsalted butter"")",487.1,25.6,14.5,264.8,597.1,49.3,0.4,29.6,15.6,4,NA,"c(""Mix bread and milk together."", ""Add the 2 eggs and the 2 egg yolks with 5 tbsp of sugar and salt."", ""Add to the milk mixture will be the vanilla and butter."", ""Mix well and pour into a slightly greased 1 1/2 quart casserole."", ""Bake in a pie pan of water at 350° oven for 45 minutes."", ""For the Meringue topping: Beat the egg whites until stiff and add the 4 tbsp of sugar to it."", ""Pour in slowly"", ""Top the already baked pudding with it--making swirly peaks for decorations."", ""Bake again at 300° until a golden brown.""
)"
82,Brazilian Empadinhas,2H37M,1H,3H37M,"""https://img.sndimg.com/food/image/upload/w_555,h_416,c_fit,fl_progressive,q_95/v1/img/recipes/82/82.jpg""",Brazilian,"c(""South American"", ""Weeknight"", ""Oven"", ""< 4 Hours"")","c(NA, ""2 1/2"", ""1/2"", ""1/4"", ""1"", ""1"", ""3"", ""1"", ""1/2"", ""1/2"", ""3"", ""1"", ""1"", NA, NA, NA, ""1/2"", ""2"", ""2"", ""1"", ""2"")","c(""butter"", ""flour"", ""salt"", ""margarine"", ""milk"", ""water"", ""shrimp"", ""onion"", ""tomatoes"", ""parsley"", ""lemon"", ""salt"", ""pepper"", ""Tabasco sauce"", ""garlic"", ""cornstarch"", ""olive oil"", ""cumin"", ""bell peppers"")",329.7,16.7,3.4,77.5,446.8,35.6,2,1.9,9.3,8,NA,"c(""DOUGH Cut butter into salt and flour."", ""Stir in rest of the ingredients and knead to  combine or just process everything until it forms a ball."", ""Let rest covered 1  hour Make balls the size of a walnut, from 2/3  of the dough and line small  muffin tins with the dough."", ""Place 2 tsp. of the cold filling into the lined  tins."", ""Make small balls with the rest of the dough."", ""Flatten them to make lids for the mini pies."", ""Brush tops with egg yolk Bake in preheated 350 F oven for 30 to  35 minutes or until golden brown."", 
""SHRIMP FILLING Clean and devein shrimp, saving heads and shells."", ""Make a broth with the shells  and heads and 2 cups water."", ""Cook 1 hour, uncovered over low heat. Strain broth  and cook it down to 1/2 cup."", ""Cook onions and garlic in olive oil until they  start changing color."", ""Add bell pepper and cook 2 minutes, Add tomatoes, broth  and seasonings and simmer almost to a paste. Add shrimp and cook just until they become opaque. Stir in cornstarch diluted in 2 Tbsp water."", ""Stir until thick."", 
""Add parsley."", ""Let cool before using"", ""NOTES : May use other fillings such as chicken, hearts of palms, cheese Miriam Podcameni Posvolsky Rio de Janeiro"")"
83,Bubble and Squeak,2H27M,30M,2H57M,character(0),Breakfast,"c(""European"", ""Weeknight"", ""Broil/Grill"", ""Oven"", ""Stove Top"", ""< 4 Hours"")","c(""2"", ""2"", ""1/4"", ""4"", ""1/3"", ""1/2"", ""1"", ""1/2"", ""1"", ""1/2"")","c(""baking potatoes"", ""unsalted butter"", ""heavy cream"", ""bacon"", ""onion"", ""celery"", ""sage"", ""white pepper"", ""Brussels sprout"")",480.7,24.9,11.5,54.9,286.1,56.9,7.6,4.9,11.1,4,NA,"c(""Wash potatoes under cold running water then place in a large saucepan."", ""Cover with salted water, bring to a boil, reduce heat and simmer until soft, uncovered, about 15 minutes."", ""Drain and set aside and allow to cool slightly."", ""Peel potatoes and mash."", ""Add butter and cream and mix well."", ""Meanwhile fry bacon until crisp."", ""Drain on paper towel and set aside. In the same skillet add onion to bacon drippings and saute until soft, about 3 - 5 minutes."", ""Stir in celery, sage and pepper and saute 2 minutes longer."", 
""Add lemon juice. Combine vegetables with mashed potatoes, stir well to combine and refrigerate for 2 hours."", ""Shape potato mixture into 10 patties."", ""Melt 2 tablespoons butter in a large skillet and saute patties until brown and crispy, about 5 minutes per side. Crumble bacon over top and serve.                    - - - - - - - - - - - - - - - - - -"")"
84,Braised Brussels Sprouts With Vinegar and Dill,23M,25M,48M,"""https://img.sndimg.com/food/image/upload/w_555,h_416,c_fit,fl_progressive,q_95/v1/img/recipes/84/pickFstbF.jpg""",Vegetable,"c(""< 60 Mins"", ""Oven"", ""Easy"")","c(""3"", ""1/4"", ""2"", NA)","c(""Brussels sprouts"", ""fresh dill"", ""wine vinegar"")",40.9,0.6,0.1,0,23.9,8.1,3,2,2.9,12,NA,"c(""Trim sprouts; halved if desired."", ""In large pot of boiling salted water, cook Brussels sprouts for 8 minutes if whole, 6 minutes if halved, or until barely tender."", ""Drain, refresh under cold running water and drain again."", ""In well-greased 13x9-inch casserole, combine sprouts, dill, vinegar, and salt and pepper to taste; mix well."", ""Bake, covered, in 350°F oven for 10 minutes."", ""Uncover and bake for 5 minutes longer."")"
85,Butter Madeira Cake,1H45M,1H10M,2H55M,"c(""https://img.sndimg.com/food/image/upload/w_555,h_416,c_fit,fl_progressive,q_95/v1/img/recipes/85/picH7CI8k.jpg"", ""https://img.sndimg.com/food/image/upload/w_555,h_416,c_fit,fl_progressive,q_95/v1/img/recipes/85/picxHaQSq.jpg"", ""https://img.sndimg.com/food/image/upload/w_555,h_416,c_fit,fl_progressive,q_95/v1/img/recipes/85/pic3a9BE3.jpg"")",Dessert,"c(""Weeknight"", ""Oven"", ""< 4 Hours"")","c(""225"", ""2"", ""175"", ""175"", ""3"", ""1"", ""1"")","c(""flour"", ""baking powder"", ""caster sugar"", ""butter"", ""eggs"", ""milk"", ""vanilla essence"")",373.8,19.9,11.8,126.3,243.8,43.9,0.8,22.2,5.5,8,NA,"c(""Grease lined tin with melted butter."", ""Sift flour and baking powder into  processor and add all remaining ingredients."", ""Run machine for 20 counts."", ""Scrape  down sides."", ""Run machine for a further 30 counts."", ""Transfer to prepared tin and spread evenly with a spatula.  Bake at 160° C for 1 1/2 hours."", ""Leave in tin 15 minutes  before turning onto a rack."", ""VARIATIONS Seed cake = Add 2-3 tsp caraway seeds after scraping down the sides."", ""Orange Cake = omit vanilla."", ""Add 1 tsp orange peel."", 
""Lemon Cake = Add 1 tsp lemon peel."", ""Chocolate Speckle Cake = Add 1 crushed Chocolate Flake Bar after scraping down sides."", ""Raisin Cake = Add 3 oz raisins after scraping down sides."", ""Spicy Cake = Add 2-3 tsp Mixed Spice with the other ingredients."")"
87,Brownies,30M,35M,1H5M,character(0),Bar Cookie,"c(""Dessert"", ""Cookie & Brownie"", ""Weeknight"", ""Oven"", ""< 4 Hours"")","c(""150"", ""1"", ""2"", ""1"", ""4"", ""50"", NA, NA, NA)","c(""bittersweet chocolate"", ""butter"", ""sugar"", ""flour"", ""eggs"", ""vanilla extract"", ""rum"", ""filter coffee"")",355.1,19.5,10.6,111.2,164.1,42.6,0.7,33.7,4.2,12,NA,"c(""Preheat oven."", ""It must be hot to begin the baking."", ""Cut the chocolate and the butter into small pieces and put together in a pan."", ""Cook until butter and chocolate are well melted and mixed (one  or two minutes). Don't let the chocolate burn or it will become too much bitter! I suggest to use always wooden tablespoons, if possible. Add the two cups of sugar and let the preparation get cold."", ""Incorporate the eggs, mixing very well after each one of them."", ""Parfum with the vanilla, the rum and the coffee. Add the nuts and the flour, mixing always very well."", 
""Put this heavy cream into a rectangular bakery pan and bake it for approximately 30 minutes."", ""Serve cold (room temperature).          Serves: about 12 big brownies (for tea time)                 about 24 small ones  (for coffee, after a meal)."")"
88,Breakfast Burritos,NA,35M,35M,character(0),Breakfast,"c(""Mexican"", ""< 60 Mins"", ""Easy"")","c(""8"", ""1"", ""2"", ""10"")","c(""eggs"", ""country sausage"", ""flour tortillas"")",1974,112.2,41.1,656.1,4146,150.2,8.8,9.3,84.7,4,NA,"c(""Scramble eggs with a small amount of milk."", ""In another pan, crumble sausage and brown."", ""Combine with cheese; cook over low flame until cheese melts."", ""Mix in just enough ketchup until mixture holds together."", ""Warm tortillas in microwave on medium for about 30 seconds until soft enough to roll up without cracking."", ""Place about 1/4 cup egg mixture in tortilla and roll up."", ""Serve with salsa."")"
